period,city,testimonial_index,testimonial_text
Q1 2026,Geneva,1,This organisation is filling a real gap in digital education in our city.
Q1 2026,Geneva,2,The workshops helped our volunteers tremendously. Highly recommended.
Q1 2026,Geneva,3,We've seen direct improvement in how our staff handles data after their programme.
Q1 2026,Geneva,4,Affordable and accessible — exactly what the community needed.
Q1 2026,Geneva,5,A bit more advanced content would be welcome for those who complete the basics.
Q1 2026,Geneva,6,The free spots policy is admirable. It truly democratises digital skills.
Q1 2026,Geneva,7,Their instructor was patient and knowledgeable. Will send more colleagues.
